{
  "schema_version": "course-release/v3",
  "release_id": "rel-11a2b3c4d5-0002",
  "release_no": 2,
  "course_id": "C-early-civilization",
  "operation": "publish",
  "parent_release_id": "rel-01a2b3c4d5-0001",
  "restored_from_release_id": null,
  "created_at": "2026-08-13T00:00:00Z",
  "created_by": "architecture-fixture",
  "note": "V3 contract fixture; not an active published release.",
  "items": [
    {
      "lesson_id": "dayu-flood-control",
      "course_id": "C-early-civilization",
      "content_version": 1,
      "source_path": "sealed/dayu-flood-control-v001.json",
      "source_checksum": "e128e00b4ad604763bd522be2eca639b3fa00aae878c6dc8a570865350eb6789",
      "course_package": {
        "kind": "course-package",
        "schema_version": "course-package/v1",
        "artifact_id": "pkg-dayu-flood-control",
        "course_id": "C-early-civilization",
        "lesson_id": "dayu-flood-control",
        "version": 1,
        "checksum": "e128e00b4ad604763bd522be2eca639b3fa00aae878c6dc8a570865350eb6789",
        "path": "runtime/v1/course-packages/C-early-civilization/dayu-flood-control/v001-e128e00b4ad604763bd522be2eca639b3fa00aae878c6dc8a570865350eb6789.json"
      },
      "scenarios": [
        {
          "kind": "scenario-template",
          "schema_version": "scenario-template/v1",
          "artifact_id": "scenario-dayu-flood-control",
          "course_id": "C-early-civilization",
          "lesson_id": "dayu-flood-control",
          "version": 1,
          "checksum": "c35aed9454005e91aa335f754d50c6a94785d49afdf6886f38a5a4e2f8e64911",
          "path": "runtime/v1/scenarios/C-early-civilization/dayu-flood-control/scenario-dayu-flood-control/v001-c35aed9454005e91aa335f754d50c6a94785d49afdf6886f38a5a4e2f8e64911.json"
        }
      ],
      "primary_scenario_id": "scenario-dayu-flood-control",
      "evidence_corpus": {
        "kind": "evidence-corpus",
        "schema_version": "evidence-corpus/v1",
        "artifact_id": "evidence-dayu-v1",
        "course_id": "C-early-civilization",
        "lesson_id": "dayu-flood-control",
        "version": 1,
        "checksum": "3333333333333333333333333333333333333333333333333333333333333333",
        "path": "runtime/v1/evidence/C-early-civilization/dayu-flood-control/evidence-dayu-v1/v001-3333333333333333333333333333333333333333333333333333333333333333.json"
      },
      "lesson_presentation": {
        "kind": "lesson-presentation",
        "schema_version": "lesson-presentation/v1",
        "artifact_id": "presentation-dayu-v1",
        "course_id": "C-early-civilization",
        "lesson_id": "dayu-flood-control",
        "version": 1,
        "checksum": "4444444444444444444444444444444444444444444444444444444444444444",
        "path": "runtime/v1/presentations/C-early-civilization/dayu-flood-control/presentation-dayu-v1/v001-4444444444444444444444444444444444444444444444444444444444444444.json"
      },
      "audience": "published"
    }
  ],
  "checksum": "3dda58e46a164389afce470216ac51f25c2bc1559eec0dc15a413bbe4d15af2b"
}
