{
  "schema_version": "course-release/v3",
  "release_id": "rel-28b5624648-0002",
  "release_no": 2,
  "course_id": "C-prequin-state",
  "operation": "publish",
  "parent_release_id": "rel-28b5624648-0001",
  "restored_from_release_id": null,
  "created_at": "2026-08-13T01:57:23.714019Z",
  "created_by": "content-publisher-admin",
  "note": "发布 L101 大禹治水正式旗舰课：课程、六回合关卡、证据库与导读资源精确绑定。",
  "items": [
    {
      "lesson_id": "L101",
      "course_id": "C-prequin-state",
      "content_version": 1,
      "source_path": "sealed/L101-v001.json",
      "source_checksum": "49ca4556d2c840491f072bfceb7b294b2af854db6d5a6e67f4bf3496ef45c03e",
      "course_package": {
        "kind": "course-package",
        "schema_version": "course-package/v1",
        "artifact_id": "pkg-L101",
        "course_id": "C-prequin-state",
        "lesson_id": "L101",
        "version": 1,
        "checksum": "8bdd1ed01fd56b4ef92d6760dbca60b28b81dcaac8d15d2f4dbc5c92645b15f5",
        "path": "runtime/v1/course-packages/C-prequin-state/L101/v001-8bdd1ed01fd56b4ef92d6760dbca60b28b81dcaac8d15d2f4dbc5c92645b15f5.json"
      },
      "scenarios": [
        {
          "kind": "scenario-template",
          "schema_version": "scenario-template/v1",
          "artifact_id": "dayu-crisis-governance",
          "course_id": "C-prequin-state",
          "lesson_id": "L101",
          "version": 1,
          "checksum": "8bd70a0e3f6dded9b6f6a24196ef79cd5009b0da9efc59c97fcd1a7926650d63",
          "path": "runtime/v1/scenarios/C-prequin-state/L101/dayu-crisis-governance/v001-8bd70a0e3f6dded9b6f6a24196ef79cd5009b0da9efc59c97fcd1a7926650d63.json"
        }
      ],
      "primary_scenario_id": "dayu-crisis-governance",
      "evidence_corpus": {
        "kind": "evidence-corpus",
        "schema_version": "evidence-corpus/v1",
        "artifact_id": "dayu-evidence",
        "course_id": "C-prequin-state",
        "lesson_id": "L101",
        "version": 1,
        "checksum": "ae736fd34b31fc99907e0a33b518dd2fd360530af95d2717e3a54832b2c1ff49",
        "path": "runtime/v1/evidence/C-prequin-state/L101/dayu-evidence/v001-ae736fd34b31fc99907e0a33b518dd2fd360530af95d2717e3a54832b2c1ff49.json"
      },
      "lesson_presentation": {
        "kind": "lesson-presentation",
        "schema_version": "lesson-presentation/v1",
        "artifact_id": "dayu-classroom-intro",
        "course_id": "C-prequin-state",
        "lesson_id": "L101",
        "version": 1,
        "checksum": "fd694a6d0ef7b76890e8faf27047e7c93624bae482c261ae3fe28403de35bb8d",
        "path": "runtime/v1/presentations/C-prequin-state/L101/dayu-classroom-intro/v001-fd694a6d0ef7b76890e8faf27047e7c93624bae482c261ae3fe28403de35bb8d.json"
      },
      "audience": "published"
    }
  ],
  "checksum": "83b3b035442d179e5df80395f54f89e8025d173222dc8922570bca66b4cdc038"
}
